company_name,domain,website_url,linkedin_url,industry,sub_industry,employee_count,revenue,revenue_range,location_city,location_state,location_country,founded_year,technologies,keywords,recent_funding,job_openings,lead_score,collection_date,notes,email_to_find,linkedin_to_scrape,enrichment_priority,target_persona
Growth Marketing Pro,growthmktgpro.com,https://growthmktgpro.com,https://linkedin.com/company/growth-marketing-pro,Marketing and Advertising,"digital marketing, lead generation, ppc",32,Not available,$1M-$10M (estimated),Austin,TX,United States,2019,"HubSpot, Salesforce, Google Ads, Facebook Ads","digital marketing, lead generation, ppc",Unknown,Unknown,85,2025-09-04,Score: 85/100 - Marketing agency target,info@growthmktgpro.com,https://linkedin.com/company/growth-marketing-pro,High,Marketing Director/CMO
Digital Boost Agency,digitalboost.co,https://digitalboost.co,https://linkedin.com/company/digital-boost-agency,Marketing and Advertising,"ppc management, conversion optimization",28,Not available,$1M-$10M (estimated),San Diego,CA,United States,2020,"HubSpot, Marketo, Google Analytics, Salesforce","ppc management, conversion optimization, digital advertising",Unknown,Unknown,82,2025-09-04,Score: 82/100 - Marketing agency target,info@digitalboost.co,https://linkedin.com/company/digital-boost-agency,High,Marketing Director/CMO
LeadGen Masters,leadgenmasters.com,https://leadgenmasters.com,https://linkedin.com/company/leadgen-masters,Marketing and Advertising,"b2b lead generation, marketing automation",24,Not available,$1M-$10M (estimated),Denver,CO,United States,2018,"Pardot, HubSpot, LinkedIn Sales Navigator","b2b lead generation, marketing automation, sales funnel",Unknown,Unknown,80,2025-09-04,Score: 80/100 - Marketing agency target,info@leadgenmasters.com,https://linkedin.com/company/leadgen-masters,High,Marketing Director/CMO
Performance Marketing Co,perfmktg.io,https://perfmktg.io,https://linkedin.com/company/performance-marketing-co,Marketing and Advertising,"performance marketing, paid acquisition",35,Not available,$1M-$10M (estimated),Miami,FL,United States,2021,"Facebook Ads Manager, Google Ads, HubSpot","performance marketing, paid acquisition, roi optimization",Unknown,Unknown,78,2025-09-04,Score: 78/100 - Marketing agency target,info@perfmktg.io,https://linkedin.com/company/performance-marketing-co,High,Marketing Director/CMO
Scale Digital,scaledigital.agency,https://scaledigital.agency,https://linkedin.com/company/scale-digital,Internet,"digital marketing, ecommerce growth",41,Not available,$1M-$10M (estimated),Portland,OR,United States,2019,"Shopify Plus, Klaviyo, Google Ads, Facebook Ads","digital marketing, ecommerce growth, conversion rate optimization",Unknown,Unknown,76,2025-09-04,Score: 76/100 - Marketing agency target,info@scaledigital.agency,https://linkedin.com/company/scale-digital,High,Marketing Director/CMO
Revenue Growth Labs,revgrowth.com,https://revgrowth.com,https://linkedin.com/company/revenue-growth-labs,Computer Software,"saas marketing, demand generation",29,Not available,$1M-$10M (estimated),Boston,MA,United States,2020,"HubSpot, Salesforce, Outreach, ZoomInfo","saas marketing, demand generation, account based marketing",Unknown,Unknown,74,2025-09-04,Score: 74/100 - Marketing agency target,info@revgrowth.com,https://linkedin.com/company/revenue-growth-labs,High,Marketing Director/CMO
Conversion Kings,conversionkings.co,https://conversionkings.co,https://linkedin.com/company/conversion-kings,Marketing and Advertising,"conversion optimization, landing page design",22,Not available,$1M-$10M (estimated),Nashville,TN,United States,2022,"Unbounce, Hotjar, Google Optimize","conversion optimization, landing page design, a/b testing",Unknown,Unknown,72,2025-09-04,Score: 72/100 - Marketing agency target,info@conversionkings.co,https://linkedin.com/company/conversion-kings,High,Marketing Director/CMO